position,color,power,title,beginning,end,time,link1,link2
hand,Green,0,Serve as Sheriff,Put 1 Privilege from the bank face up on your discard,"If you have 5 or fewer schemes in hand, draw 1",2,https://en.wikipedia.org/wiki/Nicola_de_la_Haie,https://en.wikipedia.org/wiki/Philip_Marc
bank,Yellow,1,Privilege,Take 1 gold,Draw 1,3,https://en.wikisource.org/wiki/Page:The_English_Peasant.djvu/28,https://www.marxists.org/archive/foot-paul/1981/06/1381.html
timeline,Yellow,2,Declare bankruptcy,"If your deck is empty, take 10 gold",Put 1 Privilege from the bank face down on your deck,0,https://en.wikipedia.org/wiki/Stop_of_the_Exchequer,
court,Yellow,3,Create a charity,"If you have 5 or less gold, take 10 gold",Take 1 Privilege from the bank into your hand,3,https://en.wikipedia.org/wiki/K%C3%B6sem_Sultan#Charities,https://en.wikipedia.org/wiki/Sultanate_of_Women
timeline,Yellow,4,Takeover the guilds,Pay 1 gold for each yellow scheme in play,Take the lowest power in play other than this in gold,0,https://en.wikipedia.org/wiki/History_of_Freemasonry#Origin_of_the_term_%22Freemason%22,https://en.wikipedia.org/wiki/Statute_of_Labourers_1351
hand,Green,5,Found a secret order,Revive your top discard scheme's time,Draw as many as the most powerful dungeon scheme has time,3,https://en.wikipedia.org/wiki/Illuminati#Origins,
timeline,Yellow,6,Purchase shares,Pay 1 gold for each yellow timeline scheme,"If the highest rank scheme in play is yellow, take its power in gold",3,https://en.wikipedia.org/wiki/Gregor_MacGregor,
timeline,Yellow,7,Survive your jailer,Pay 1 gold for each timeline scheme,Take the most powerful dungeon scheme's power in gold,3,https://en.wikipedia.org/wiki/Eleanor_of_Aquitaine#Widowhood,https://en.wikipedia.org/wiki/Charter_of_the_Forest
timeline,Green,8,Impersonate a foreign Countess,Revive the highest time in the dungeon,Draw the highest time in play,3,https://en.wikipedia.org/wiki/The_Count_of_Monte_Cristo,https://en.wikipedia.org/wiki/Pierre_Picaud
timeline,Green,9,Promise a title,"If your deck has 5 or more schemes, appoint the top 1 to the court","If it has 5 or fewer schemes, draw your entire deck",0,"https://en.wikipedia.org/wiki/Henry_Stafford,_2nd_Duke_of_Buckingham",https://en.wikipedia.org/wiki/Richard_III_(play)
hand,Yellow,10,Entrap the Chamberlain,"If your top discard scheme is yellow, take 5 gold","If the left timeline scheme is yellow, take its power in gold",2,https://www.businessinsider.com/medieval-french-finance-ministers-executed-2013-4?international=true&r=US&IR=T,https://en.wikipedia.org/wiki/Enguerrand_de_Marigny
timeline,Green,11,Bribe the secretary,Pay 5 gold,Draw the total time of all dungeon schemes,1,"https://en.wikipedia.org/wiki/Mary,_Queen_of_Scots",https://en.wikipedia.org/wiki/David_Rizzio
timeline,Green,12,Revolutionize court fashion,Revive 1 for each green timeline scheme,Draw 1 for each green timeline scheme,0,https://www.nationalgeographic.com/history/magazine/2016/09-10/daily-life-france-fashion-marie-antoinette/,https://www.apollo-magazine.com/marie-antoinette-versailles-theatre-restored/
dungeon,Green,13,Advocate reform,Appoint 1 Privilege from the bank to the court,Draw until you have 6 schemes in hand,2,https://en.wikipedia.org/wiki/Margaret_Fell,https://plato.stanford.edu/entries/margaret-fell/
timeline,Green,14,Become the Queen of Thieves ,Revive 1 for each unique dungeon scheme,Draw 1 for each unique dungeon scheme,0,https://es.wikipedia.org/wiki/Rinconete_y_Cortadillo,
hand,Yellow,15,Host a wedding,Pay 1 gold for each scheme in your hand,"If the left 2 timeline schemes are the same color, take the lower power in gold",1,https://en.wikipedia.org/wiki/Margaret_of_Valois,https://en.wikipedia.org/wiki/St._Bartholomew%27s_Day_massacre
timeline,Green,16,Vote in the College of Electresses,Revive 1 for each more powerful scheme in play,Draw 1 for each less powerful scheme in play,0,https://en.wikipedia.org/wiki/1002_German_royal_election,
timeline,Green,17,Choose the next Pope,Pay 30 gold,Revive until you have 10 schemes in hand,3,https://en.wikipedia.org/wiki/Pope_Joan,https://en.wikipedia.org/wiki/Marozia
timeline,Red,18,Buccaneer a treasure ship,"If the least powerful scheme in play is red, take its power in gold","Otherwise, threaten it",0,https://en.wikipedia.org/wiki/Sayyida_al_Hurra,https://en.wikipedia.org/wiki/Al-hurra
timeline,Red,19,Declare martial law,"If the left timeline scheme is green, threaten it",Draw its time,0,https://en.wikipedia.org/wiki/The_Protectorate,https://en.wikipedia.org/wiki/Oliver_Cromwell
hand,Red,20,Lead from the front,Threaten the least powerful green scheme in play,Threaten the least powerful yellow scheme in play,0,https://en.wikipedia.org/wiki/Joan_of_Arc,https://en.wikipedia.org/wiki/Siege_of_Orl%C3%A9ans
discard,Yellow,21,Evict the tenants,"If your top discard scheme has 25 or less power, take it in gold","If you took gold, appoint it to the court",1,https://en.wikipedia.org/wiki/Star_Chamber,https://core.ac.uk/reader/189162082
timeline,Red,22,Plunder the treasury,"If the left timeline scheme is yellow, threaten it",Threaten the most powerful yellow scheme in play,0,"https://en.wikipedia.org/wiki/Francisco_G%C3%B3mez_de_Sandoval,_1st_Duke_of_Lerma",https://en.wikipedia.org/wiki/The_Great_Favourite
timeline,Red,23,Challenge to a duel,Threaten the most powerful green scheme in play,"If it is less powerful, threaten it again",0,https://en.wikipedia.org/wiki/Agnes_Hotot,https://www.proquest.com/openview/c8826cbfd5114bef1f2a845217a0a771/1?pq-origsite=gscholar&cbl=18750
timeline,Red,24,Rob the wretched,Threaten the least powerful green dungeon scheme,Threaten the least powerful yellow dungeon scheme,0,https://en.wikipedia.org/wiki/Mary_Frith,https://www.npg.org.uk/collections/search/person/mp70624/mary-frith-moll-cutpurse
deck,Red,25,Dub a Dame in shining armor,"If your top discard scheme is red, revive 1","Otherwise, threaten it",2,https://en.wikipedia.org/wiki/Order_of_the_Hatchet,https://quod.lib.umich.edu/e/eebo/A26024.0001.001/1:10.3?rgn=div2;view=fulltext
timeline,Red,26,Torture the spymaster,Threaten the most powerful green dungeon scheme,Revive as many as it has time,3,https://en.wikipedia.org/wiki/Isabella_of_France,https://en.wikipedia.org/wiki/Hugh_Despenser_the_Younger
timeline,Red,27,Jailbreak,Threaten the most powerful yellow dungeon scheme,"If it is less powerful, take its power in gold",3,https://en.wikipedia.org/wiki/Giacomo_Casanova#Imprisonment_and_escape,
timeline,Red,28,Storm the dungeon,"If the least powerful dungeon scheme is not red, threaten it","If the most powerful dungeon scheme is not red, threaten it",1,https://en.wikipedia.org/wiki/Storming_of_the_Bastille,https://en.wikipedia.org/wiki/Great_Fear
timeline,Red,29,Unite the armies,"If every scheme in play is red, draw 1 for each player","Otherwise, threaten the most powerful scheme in play that is not red",3,https://en.wikipedia.org/wiki/Nzinga_of_Ndongo_and_Matamba,https://en.wikipedia.org/wiki/Kingdom_of_Matamba
timeline,Red,30,Spread the rebellion,"If your top discard scheme is red, threaten the right timeline scheme","Otherwise, threaten the left timeline scheme",3,https://en.wikipedia.org/wiki/John_Ball_(priest)#Biography,https://en.wikipedia.org/wiki/Peasants%27_Revolt
timeline,Yellow,31,Steal from the rich and give to the poor,Take 10 gold for each timeline scheme,Pay 1 gold for each lower rank scheme in play,2,https://en.wikipedia.org/wiki/Maid_Marian,https://en.wikipedia.org/wiki/Robin_Hood#Historicity
timeline,Yellow,32,Reclaim your rights,"If your top discard scheme is yellow, take its power in gold","Otherwise, draw 1 for each timeline scheme of its color",3,https://en.wikipedia.org/wiki/Caroline_of_Brunswick,https://en.wikipedia.org/wiki/Pains_and_Penalties_Bill_1820
timeline,Yellow,33,Learn ancient alchemy,Take your top discard scheme's power in gold,"If it is not yellow, appoint it to the court",3,http://scihi.org/mary-the-jewess-origins-chemistry/,https://web.nli.org.il/sites/nli/english/library/reading_corner/pages/maria_the_jewess.aspx
timeline,Yellow,34,Steal the diamond,Take the right timeline scheme's power in gold,"If there is a red scheme in play, pay 25 gold",2,https://en.wikipedia.org/wiki/Jeanne_de_Valois-Saint-R%C3%A9my,https://en.wikipedia.org/wiki/Affair_of_the_Diamond_Necklace
timeline,Yellow,35,Mint coins,Take the left timeline scheme's time in gold,"If you have the left timeline scheme's power or less gold, take it in gold",3,https://en.wikipedia.org/wiki/The_Great_Debasement,
timeline,Yellow,36,Embezzle funds,Take 25 gold for each unique yellow dungeon scheme,Take the lowest dungeon power in gold,3,https://en.wikipedia.org/wiki/Nicolas_Fouquet#Trial_and_life_imprisonment,https://en.wikipedia.org/wiki/Man_in_the_Iron_Mask#Masked_man_serves_as_a_valet
timeline,Yellow,37,Marry the Duchess,Pay the left timeline scheme's time in gold,Take its power in gold,3,https://en.wikipedia.org/wiki/Emma_of_Normandy,https://en.wikipedia.org/wiki/Encomium_Emmae_Reginae
timeline,Yellow,38,Sell an office,Take the top scheme in your deck's power in gold,Appoint it to the court,1,"https://en.wikipedia.org/wiki/Richard_Rich,_1st_Baron_Rich",https://en.wikipedia.org/wiki/Anne_Askew
timeline,Yellow,39,Smuggle contraband,"If your top discard scheme does not have more power, take it in gold",Put your top discard scheme face down on your deck,3,https://www.washingtonpost.com/opinions/tales-of-miscreant-smugglers-in-america/2015/08/20/0ad4e174-4049-11e5-8d45-d815146f81fa_story.html,
timeline,Yellow,40,Hold a market fair,Pay 1 gold for each timeline scheme of the left color,Take 25 gold for each timeline scheme of the right color,3,https://en.wikipedia.org/wiki/Joan_I_of_Navarre,https://en.wikipedia.org/wiki/Champagne_fairs
timeline,Yellow,41,Blackmail her Majesty,Take the highest dungeon power in gold,Taked the highest power in play in gold,3,https://en.wikipedia.org/wiki/Libelle_(literary_genre),https://en.wikipedia.org/wiki/Let_them_eat_cake
timeline,Green,42,Enclose peasant land,Pay 1 gold,Draw your entire deck,1,https://en.wikipedia.org/wiki/Statute_of_Merton,https://camdencivilrightsproject.com/2015/11/14/discourse-on-the-origin-of-inequality-among-mankind/
timeline,Green,43,Display piety,"If you have 5 or less schemes in hand, revive 10","If your discard is empty, draw 10",3,https://en.wikipedia.org/wiki/Maria_I_of_Portugal,"https://en.wikipedia.org/wiki/Sebasti%C3%A3o_Jos%C3%A9_de_Carvalho_e_Melo,_1st_Marquis_of_Pombal"
timeline,Green,44,Defeat the Church,Revive until your top discard scheme is not red,"If your top discard scheme is green, draw 10",3,"https://en.wikipedia.org/wiki/Elizabeth_I#Mary,_Queen_of_Scots",https://en.wikipedia.org/wiki/Regnans_in_Excelsis
timeline,Green,45,Mask the Crown Princess,Appoint your top discard scheme to the court until it is green,Revive your entire discard,3,https://en.wikipedia.org/wiki/Man_in_the_Iron_Mask,https://en.wikipedia.org/wiki/The_Vicomte_of_Bragelonne:_Ten_Years_Later
timeline,Green,46,Rule alongside your mother,"If your top discard scheme is green, revive 5",Draw 5,3,https://en.wikipedia.org/wiki/Matilda_of_Tuscany,https://storicamente.org/dempsey-matilda-of-tuscany
timeline,Green,47,Invest a Bishop,Revive 1 for each scheme in play with 30 or more power,Draw until you have 10 schemes in hand,3,https://en.wikipedia.org/wiki/Investiture_Controversy#Henry_IV_and_Pope_Gregory_VII,https://en.wikipedia.org/wiki/Padroado
timeline,Green,48,Give fealty,Pay 10 gold,"If you have 1 or more gold, draw 10",3,https://en.wikipedia.org/wiki/Danegeld,https://en.wikipedia.org/wiki/Cnut
timeline,Green,49,Become a saint,Pay 25 gold,"If you have 25 or less gold, draw as many as you have gold",3,https://en.wikipedia.org/wiki/Pulcheria#Empress,https://en.wikipedia.org/wiki/Second_Council_of_Ephesus#Opening_proceeding
timeline,Green,50,Collect debtors,Pay the total time of all dungeon schemes,"If the highest dungeon power is 25 or less, draw that many",3,https://simple.wikipedia.org/wiki/Serfdom#Becoming_a_serf,https://en.wikipedia.org/wiki/Serfdom#Initiation
timeline,Green,52,Declare independence,Take 10 times as much gold as you have,Draw 1 for each scheme in your hand,0,https://en.wikipedia.org/wiki/Nanny_of_the_Maroons,https://en.wikipedia.org/wiki/First_Maroon_War